{
  "captured_at": "2026-08-14T09:33:06.708019+00:00",
  "capture_host": "gpu704",
  "sources": {
    "workspace": "/mnt/ssd-SATARAID5/harry/projects/cfd_agentic_benchmark/cfd_solver_benchmark_workspace_template/workspace/oc-goal/kimik3-dsv4/01",
    "codex_home": "/mnt/ssd-SATARAID5/harry/projects/cfd_agentic_benchmark/cfd_solver_benchmark_workspace_template/workspace/oc-goal/kimik3-dsv4/01/.sessions/codex",
    "opencode_config_dir": "/mnt/ssd-SATARAID5/harry/projects/cfd_agentic_benchmark/cfd_solver_benchmark_workspace_template/workspace/oc-goal/kimik3-dsv4/01/.sessions/opencode-config",
    "opencodex_config_dir": "/mnt/ssd-SATARAID5/harry/projects/cfd_agentic_benchmark/cfd_solver_benchmark_workspace_template/workspace/oc-goal/kimik3-dsv4/01/.sessions/opencodex"
  },
  "redaction": {
    "policy": "secret-like values and credential files are never embedded; see cfdeval/redact.py",
    "total_hits": 0,
    "marker": "***REDACTED***"
  },
  "configs": [
    {
      "role": "codex",
      "kind": "file",
      "path": "/mnt/ssd-SATARAID5/harry/projects/cfd_agentic_benchmark/cfd_solver_benchmark_workspace_template/workspace/oc-goal/kimik3-dsv4/01/.sessions/codex/config.toml",
      "exists": false,
      "sha256": null,
      "bytes": null,
      "content": null,
      "content_included": false,
      "redacted": false,
      "redaction_hits": 0,
      "truncated": false,
      "notes": []
    },
    {
      "role": "codex",
      "kind": "file",
      "path": "/mnt/ssd-SATARAID5/harry/projects/cfd_agentic_benchmark/cfd_solver_benchmark_workspace_template/workspace/oc-goal/kimik3-dsv4/01/.sessions/codex/ocx.config.toml",
      "exists": false,
      "sha256": null,
      "bytes": null,
      "content": null,
      "content_included": false,
      "redacted": false,
      "redaction_hits": 0,
      "truncated": false,
      "notes": []
    },
    {
      "role": "codex",
      "kind": "file",
      "path": "/mnt/ssd-SATARAID5/harry/projects/cfd_agentic_benchmark/cfd_solver_benchmark_workspace_template/workspace/oc-goal/kimik3-dsv4/01/.sessions/codex/opencodex.config.toml",
      "exists": false,
      "sha256": null,
      "bytes": null,
      "content": null,
      "content_included": false,
      "redacted": false,
      "redaction_hits": 0,
      "truncated": false,
      "notes": []
    },
    {
      "role": "codex",
      "kind": "file",
      "path": "/mnt/ssd-SATARAID5/harry/projects/cfd_agentic_benchmark/cfd_solver_benchmark_workspace_template/workspace/oc-goal/kimik3-dsv4/01/.sessions/codex/AGENTS.md",
      "exists": false,
      "sha256": null,
      "bytes": null,
      "content": null,
      "content_included": false,
      "redacted": false,
      "redaction_hits": 0,
      "truncated": false,
      "notes": []
    },
    {
      "role": "codex",
      "kind": "file",
      "path": "/mnt/ssd-SATARAID5/harry/projects/cfd_agentic_benchmark/cfd_solver_benchmark_workspace_template/workspace/oc-goal/kimik3-dsv4/01/.sessions/codex/codex-runtime.json",
      "exists": false,
      "sha256": null,
      "bytes": null,
      "content": null,
      "content_included": false,
      "redacted": false,
      "redaction_hits": 0,
      "truncated": false,
      "notes": []
    },
    {
      "role": "codex",
      "kind": "file",
      "path": "/mnt/ssd-SATARAID5/harry/projects/cfd_agentic_benchmark/cfd_solver_benchmark_workspace_template/workspace/oc-goal/kimik3-dsv4/01/.sessions/codex/version.json",
      "exists": false,
      "sha256": null,
      "bytes": null,
      "content": null,
      "content_included": false,
      "redacted": false,
      "redaction_hits": 0,
      "truncated": false,
      "notes": []
    },
    {
      "role": "codex",
      "kind": "file",
      "path": "/mnt/ssd-SATARAID5/harry/projects/cfd_agentic_benchmark/cfd_solver_benchmark_workspace_template/workspace/oc-goal/kimik3-dsv4/01/.sessions/codex/opencodex-catalog.json",
      "exists": false,
      "sha256": null,
      "bytes": null,
      "content": null,
      "content_included": false,
      "redacted": false,
      "redaction_hits": 0,
      "truncated": false,
      "notes": []
    },
    {
      "role": "codex",
      "kind": "file",
      "path": "/mnt/ssd-SATARAID5/harry/projects/cfd_agentic_benchmark/cfd_solver_benchmark_workspace_template/workspace/oc-goal/kimik3-dsv4/01/.sessions/codex/models_cache.json",
      "exists": false,
      "sha256": null,
      "bytes": null,
      "content": null,
      "content_included": false,
      "redacted": false,
      "redaction_hits": 0,
      "truncated": false,
      "notes": []
    },
    {
      "role": "codex",
      "kind": "file",
      "path": "/mnt/ssd-SATARAID5/harry/projects/cfd_agentic_benchmark/cfd_solver_benchmark_workspace_template/workspace/oc-goal/kimik3-dsv4/01/.sessions/codex/auth.json",
      "exists": false,
      "sha256": null,
      "bytes": null,
      "content": null,
      "content_included": false,
      "redacted": false,
      "redaction_hits": 0,
      "truncated": false,
      "notes": []
    },
    {
      "role": "codex",
      "kind": "file",
      "path": "/mnt/ssd-SATARAID5/harry/projects/cfd_agentic_benchmark/cfd_solver_benchmark_workspace_template/workspace/oc-goal/kimik3-dsv4/01/.sessions/codex/installation_id",
      "exists": false,
      "sha256": null,
      "bytes": null,
      "content": null,
      "content_included": false,
      "redacted": false,
      "redaction_hits": 0,
      "truncated": false,
      "notes": []
    },
    {
      "role": "opencode",
      "kind": "file",
      "path": "/mnt/ssd-SATARAID5/harry/projects/cfd_agentic_benchmark/cfd_solver_benchmark_workspace_template/workspace/oc-goal/kimik3-dsv4/01/.sessions/opencode-config/opencode.jsonc",
      "exists": false,
      "sha256": null,
      "bytes": null,
      "content": null,
      "content_included": false,
      "redacted": false,
      "redaction_hits": 0,
      "truncated": false,
      "notes": []
    },
    {
      "role": "opencode",
      "kind": "file",
      "path": "/mnt/ssd-SATARAID5/harry/projects/cfd_agentic_benchmark/cfd_solver_benchmark_workspace_template/workspace/oc-goal/kimik3-dsv4/01/.sessions/opencode-config/tui.json",
      "exists": false,
      "sha256": null,
      "bytes": null,
      "content": null,
      "content_included": false,
      "redacted": false,
      "redaction_hits": 0,
      "truncated": false,
      "notes": []
    },
    {
      "role": "opencode",
      "kind": "file",
      "path": "/mnt/ssd-SATARAID5/harry/projects/cfd_agentic_benchmark/cfd_solver_benchmark_workspace_template/workspace/oc-goal/kimik3-dsv4/01/.sessions/opencode-config/agents.json",
      "exists": false,
      "sha256": null,
      "bytes": null,
      "content": null,
      "content_included": false,
      "redacted": false,
      "redaction_hits": 0,
      "truncated": false,
      "notes": []
    },
    {
      "role": "opencode",
      "kind": "file",
      "path": "/mnt/ssd-SATARAID5/harry/projects/cfd_agentic_benchmark/cfd_solver_benchmark_workspace_template/workspace/oc-goal/kimik3-dsv4/01/.sessions/opencode-data/opencode/auth.json",
      "exists": false,
      "sha256": null,
      "bytes": null,
      "content": null,
      "content_included": false,
      "redacted": false,
      "redaction_hits": 0,
      "truncated": false,
      "notes": []
    },
    {
      "role": "opencodex",
      "kind": "file",
      "path": "/mnt/ssd-SATARAID5/harry/projects/cfd_agentic_benchmark/cfd_solver_benchmark_workspace_template/workspace/oc-goal/kimik3-dsv4/01/.sessions/opencodex/config.json",
      "exists": false,
      "sha256": null,
      "bytes": null,
      "content": null,
      "content_included": false,
      "redacted": false,
      "redaction_hits": 0,
      "truncated": false,
      "notes": []
    },
    {
      "role": "opencodex",
      "kind": "file",
      "path": "/mnt/ssd-SATARAID5/harry/projects/cfd_agentic_benchmark/cfd_solver_benchmark_workspace_template/workspace/oc-goal/kimik3-dsv4/01/.sessions/opencodex/version.json",
      "exists": false,
      "sha256": null,
      "bytes": null,
      "content": null,
      "content_included": false,
      "redacted": false,
      "redaction_hits": 0,
      "truncated": false,
      "notes": []
    },
    {
      "role": "opencodex",
      "kind": "file",
      "path": "/mnt/ssd-SATARAID5/harry/projects/cfd_agentic_benchmark/cfd_solver_benchmark_workspace_template/workspace/oc-goal/kimik3-dsv4/01/.sessions/opencodex/codex-runtime.json",
      "exists": false,
      "sha256": null,
      "bytes": null,
      "content": null,
      "content_included": false,
      "redacted": false,
      "redaction_hits": 0,
      "truncated": false,
      "notes": []
    },
    {
      "role": "opencodex",
      "kind": "file",
      "path": "/mnt/ssd-SATARAID5/harry/projects/cfd_agentic_benchmark/cfd_solver_benchmark_workspace_template/workspace/oc-goal/kimik3-dsv4/01/.sessions/opencodex/responses-state.json",
      "exists": false,
      "sha256": null,
      "bytes": null,
      "content": null,
      "content_included": false,
      "redacted": false,
      "redaction_hits": 0,
      "truncated": false,
      "notes": []
    },
    {
      "role": "opencodex",
      "kind": "file",
      "path": "/mnt/ssd-SATARAID5/harry/projects/cfd_agentic_benchmark/cfd_solver_benchmark_workspace_template/workspace/oc-goal/kimik3-dsv4/01/.sessions/opencodex/codex-quota-cache.json",
      "exists": false,
      "sha256": null,
      "bytes": null,
      "content": null,
      "content_included": false,
      "redacted": false,
      "redaction_hits": 0,
      "truncated": false,
      "notes": []
    },
    {
      "role": "opencodex",
      "kind": "file",
      "path": "/mnt/ssd-SATARAID5/harry/projects/cfd_agentic_benchmark/cfd_solver_benchmark_workspace_template/workspace/oc-goal/kimik3-dsv4/01/.sessions/opencodex/codex-accounts.json",
      "exists": false,
      "sha256": null,
      "bytes": null,